<?xml version="1.0" encoding="UTF-8"?>
<!DOCTYPE ConfiG PUBLIC "-//NET/ATOMIQUE/KSAR/CONFIG.DTD" "Config.dtd">
<!--
    Document   : Config.xml
    Created on : 10 aoÃ»t 2010, 16:31
    Author     : Max
    Description:
        Configure color of graphs

-->


<ConfiG>

    <!--  BEGIN OS -->
    <OS>
        <OSType name="Esar">
            <Stat name="file">
                <headerstr>CPU iget/s namei/s dirbk/s</headerstr>
                <graphname>FILE</graphname>
            </Stat>
            <Stat name="buffer">
                <headerstr>CPU bread/s lread/s %rcache bwrite/s lwrite/s %wcache phread/s phwrite/s</headerstr>
                <graphname>BUFFER</graphname>
            </Stat>
            <Stat name="syscall">
                <headerstr>CPU scall/s sread/s swrit/s fork/s vfork/s exec/s rchar/s wchar/s intr/s trap/s</headerstr>
                <graphname>SYSCALL</graphname>
            </Stat>
            <Stat name="device">
                <headerstr>device %busy read/s write/s kbr/s kbw/s avqr avqw avwait avserv</headerstr>
                <graphname>DEVICE</graphname>
            </Stat>
            <Stat name="">
                <headerstr>CPU pgout/s ppgout/s pgfree/s pgscan/s %ufs_ipf</headerstr>
                <graphname></graphname>
            </Stat>
            <Stat name="">
                <headerstr>CPU msg/s sema/s</headerstr>
                <graphname></graphname>
            </Stat>
            <Stat name="">
                <headerstr>CPU atch/s pgin/s ppgin/s pflt/s vflt/s slock/s</headerstr>
                <graphname></graphname>
            </Stat>
            <Stat name="">
                <headerstr>runq-sz %runocc swpq-sz %swpocc</headerstr>
                <graphname></graphname>
            </Stat>
            <Stat name="">
                <headerstr>freemem freeswap swpunalloc swpreserv swpalloc</headerstr>
                <graphname></graphname>
            </Stat>
            <Stat name="">
                <headerstr>CPU %usr %sys %wio %idle %w_io %w_swap %w_pio</headerstr>
                <graphname></graphname>
            </Stat>
            <Stat name="">
                <headerstr>CPU swpin/s kbswin/s swpot/s kbswot/s pswch/s</headerstr>
                <graphname></graphname>
            </Stat>
            <Stat name="">
                <headerstr>CPU rawch/s canch/s outch/s rcvin/s xmtin/s mdmin/s</headerstr>
                <graphname></graphname>
            </Stat>
            <Stat name="">
                <headerstr>la1 la5 la15 nproc</headerstr>
                <graphname></graphname>
            </Stat>
            <Stat name="">
                <headerstr>interface ipacket/s opacket/s ibits/s obits/s ierror/s oerror/s %util</headerstr>
                <graphname></graphname>
            </Stat>
            <Stat name="">
                <headerstr>interface bcstrcv/s bcstxmt/s mcstrcv/s mcstxmt/s norcvbf/s noxmtbf/s coll/s</headerstr>
                <graphname></graphname>
            </Stat>
            <Stat name="">
                <headerstr>pset la1 la5 la15 ncpus</headerstr>
                <graphname></graphname>
            </Stat>
            <Stat name="">
                <headerstr>RAWIP inDgms/s inErrs/s outDgms/s outErrs/s CksErrs/s</headerstr>
                <graphname></graphname>
            </Stat>
            <Stat name="">
                <headerstr>UDP inDgms/s inErrs/s outDgms/s outErrs/s</headerstr>
                <graphname></graphname>
            </Stat>
            <Stat name="">
                <headerstr>TCP actvOpens/s atmptFails/s currEstab estabRsts/s hlfOpenDrp/s listenDrop/s listDropQ0/s passvOpens/s</headerstr>
                <graphname></graphname>
            </Stat>
            <Stat name="">
                <headerstr>RPCD(tcp) badcalls badlen calls dupchk dupreqs nullrcv xdrcall</headerstr>
                <graphname></graphname>
            </Stat>
            <Stat name="">
                <headerstr>RPC(tcp) badcalls badverfs badxids calls cantconn intrpts newcreds nomem timeouts timers</headerstr>
                <graphname></graphname>
            </Stat>
            <Stat name="">
                <headerstr>RPCD(udp) badcalls badlen calls dupchk dupreqs nullrcv xdrcall</headerstr>
                <graphname></graphname>
            </Stat>
            <Stat name="">
                <headerstr>RPC(udp) badcalls badverfs badxids calls cantsend retrans newcreds nomem timeouts timers</headerstr>
                <graphname></graphname>
            </Stat>
            <Stat name="">
                <headerstr>NFS v2 create link lookup mkdir read readdir readlnk remove rename rmdir symlnk write</headerstr>
                <graphname></graphname>
            </Stat>
            <Stat name="">
                <headerstr>NFS v2  getattr null root setattr statfs wrcache</headerstr>
                <graphname></graphname>
            </Stat>
            <Stat name="">
                <headerstr>NFSD v2 create link lookup mkdir read readdir readlnk remove rename rmdir symlnk write</headerstr>
                <graphname></graphname>
            </Stat>
            <Stat name="">
                <headerstr>NFSD v2 getattr null root setattr statfs wrcache</headerstr>
                <graphname></graphname>
            </Stat>
            <Stat name="">
                <headerstr>NFS v3 access commit create link lookup mkdir read readlnk remove rename rmdir symlink write</headerstr>
                <graphname></graphname>
            </Stat>
            <Stat name="">
                <headerstr>NFS v3 fsstat getattr fsinfo null pathconf setattr mknod readdir readirp</headerstr>
                <graphname></graphname>
            </Stat>
            <Stat name="">
                <headerstr>NFSD v3 access commit create link lookup mkdir read readlnk remove rename rmdir symlink write</headerstr>
                <graphname></graphname>
            </Stat>
            <Stat name="">
                <headerstr> NFSD v3 fsstat getattr fsinfo null pathconf setattr mknod readdir readirp</headerstr>
                <graphname></graphname>
            </Stat>
            <Stat name="">
                <headerstr>NFS v4 access close create link open read readdir readlnk remove rename renew verify write</headerstr>
                <graphname></graphname>
            </Stat>
            <Stat name="">
                <headerstr>NFS v4 commit compnd dpurge dreturn getattr lookup lookupp null nverify opencnf opendwg openatr reservd secinfo setattr</headerstr>
                <graphname></graphname>
            </Stat>
            <Stat name="">
                <headerstr>NFS v4 lock lockt locku getfh putfh ptpubfh ptrtfh rstrfh savefh setid setidcnf</headerstr>
                <graphname></graphname>
            </Stat>
            <Stat name="">
                <headerstr>NFSD v4 access close create link open read readdir readlnk remove rename renew verify write</headerstr>
                <graphname></graphname>
            </Stat>
            <Stat name="">
                <headerstr>NFSD v4 commit compnd dpurge dreturn getattr lookup lookupp null nverify opencnf opendwg openatr reservd secinfo setattr</headerstr>
                <graphname></graphname>
            </Stat>
            <Stat name="">
                <headerstr>NFSD v4 lock lockt locku getfh putfh ptpubfh ptrtfh rstrfh savefh setid setidcnf rlckownr illegal</headerstr>
                <graphname></graphname>
            </Stat>
            <Stat name="">
                <headerstr>Total Kernel Locked Avail</headerstr>
                <graphname></graphname>
            </Stat>
        </OSType>
    </OS>
</ConfiG>
