<?xml version="1.0" encoding="UTF-8"?>
<!DOCTYPE ConfiG PUBLIC "-//NET/ATOMIQUE/KSAR/CONFIG.DTD" "config.dtd">
<!--
    Description:
        Configure statistics and their corresponding graphs (plots+stacks)
-->

<ConfiG>
   
    <!--  BEGIN OS -->
    <OS>
        <OSType name="HP-UX">
            <Stat name="cpu1">
                <headerstr>%usr %sys %wio %idle</headerstr>
                <graphname>CPU</graphname>
            </Stat>
            <Stat name="device1">
                <headerstr>device %busy avque r+w/s blks/s avwait avserv</headerstr>
                <graphname>DEVICE</graphname>
            </Stat>
            <Stat name="runq">
                <headerstr>runq-sz %runocc swpq-sz %swpocc</headerstr>
                <graphname>RUNQ</graphname>
            </Stat>
            <Stat name="buffer">
                <headerstr>bread/s lread/s %rcache bwrit/s lwrit/s %wcache pread/s pwrit/s</headerstr>
                <graphname>BUFFER</graphname>
            </Stat>
            <Stat name="swap">
                <headerstr>swpin/s bswin/s swpot/s bswot/s pswch/s</headerstr>
                <graphname>SWAP</graphname>
            </Stat>
            <Stat name="syscall">
                <headerstr>scall/s sread/s swrit/s fork/s exec/s rchar/s wchar/s</headerstr>
                <graphname>SYSCALL</graphname>
            </Stat>
            <Stat name="file">
                <headerstr>iget/s namei/s dirbk/s</headerstr>
                <graphname>FILE</graphname>
            </Stat>
            <Stat name="tty">
                <headerstr>rawch/s canch/s outch/s rcvin/s xmtin/s mdmin/s</headerstr>
                <graphname>TTY</graphname>
            </Stat>
            <Stat name="ksize">
                <headerstr>text-sz ov proc-sz ov inod-sz ov file-sz ov</headerstr>
                <graphname>IGNORE</graphname>
            </Stat>
            <Stat name="msgs">
                <headerstr>msg/s sema/s</headerstr>
                <graphname>MSGS</graphname>
            </Stat>
            <Stat name="cpu2">
                <headerstr>cpu %usr %sys %wio %idle</headerstr>
                <graphname>CPU</graphname>
            </Stat>
            <Graph name="CPU" Title="CPU" type="multiple">
                <Stack Title="Used" size="3">
                    <cols>%usr %sys %wio</cols>
                    <range>0,100</range>
                </Stack>
                <Plot Title="Idle">
                    <cols>%idle</cols>
                </Plot>
            </Graph>
            <Graph name="DEVICE" Title="Device" type="multiple">
                <Plot Title="busy">
                    <cols>%busy</cols>
                </Plot>
                <Plot Title="avque">
                    <cols>avque</cols>
                </Plot>
                <Plot Title="r+w/s">
                    <cols>r+w/s</cols>
                </Plot>
                <Plot Title="blks/s">
                    <cols>blks/s</cols>
                </Plot>
                <Plot Title="avwait">
                    <cols>avwait</cols>
                </Plot>
                <Plot Title="avserv">
                    <cols>avserv</cols>
                </Plot>
            </Graph>
            <Graph name="RUNQ" Title="RunQ" type="unique">
                <Plot Title="runQ">
                    <cols>runq-sz</cols>
                </Plot>
                <Plot Title="swapQ">
                    <cols>swpq-sz</cols>
                </Plot>
            </Graph>
            <Graph name="BUFFER" Title="Buffer" type="unique">
                <Plot Title="read">
                    <cols>bread/s lread/s</cols>
                </Plot>
                <Plot Title="write">
                    <cols>bwrit/s lwrit/s</cols>
                </Plot>
                <Plot Title="physical">
                    <cols>pread/s pwrit/s</cols>
                </Plot>
                <Plot Title="%">
                    <cols>%rcache %wcache</cols>
                </Plot>
            </Graph>
            <Graph name="SWAP" Title="Swap" type="unique">
                <Plot Title="lwp">
                    <cols>swpin/s swpot/s</cols>
                </Plot>
                <Plot Title="page">
                    <cols>bswin/s bswot/s</cols>
                </Plot>
                <Plot Title="switch">
                    <cols>pswch/s</cols>
                </Plot>
            </Graph>
            <Graph name="SYSCALL" Title="Syscal" type="unique">
                <Plot Title="syscall">
                    <cols>scall/s</cols>
                </Plot>
                <Plot Title="r/w">
                    <cols>sread/s swrit/s</cols>
                </Plot>
                <Plot Title="fork">
                    <cols>fork/s exec/s</cols>
                </Plot>
                <Plot Title="char">
                    <cols>rchar/s wchar/s</cols>
                </Plot>
            </Graph>
            <Graph name="FILE" Title="File" type="unique">
                <Plot Title="file">
                    <cols>iget/s namei/s dirbk/s</cols>
                </Plot>
            </Graph>
            <Graph name="TTY" Title="Tty" type="unique">
                <Plot Title="TTY">
                    <cols>rawch/s canch/s outch/s rcvin/s xmtin/s mdmin/s</cols>
                </Plot>
            </Graph>
            <Graph name="MSGS" Title="Messages / Semaphores" type="unique">
                <Plot Title="Messages">
                    <cols>msg/s</cols>
                </Plot>
                <Plot Title="Semaphores">
                    <cols>sema/s</cols>
                </Plot>
            </Graph>
        </OSType>
    </OS>
    <!--  END OS -->
</ConfiG>

